{
  "$schema": "https://digster.github.io/mindflow/docs/schema/mindflow-1.2.0.schema.json",
  "type": "mindflow.board",
  "schemaVersion": "1.2.0",
  "id": "brd_Connectors",
  "meta": {
    "name": "Bound connectors",
    "createdAt": "2026-08-14T10:00:00.000Z",
    "updatedAt": "2026-08-14T12:00:00.000Z",
    "app": {
      "name": "mindflow",
      "version": "0.1.0"
    }
  },
  "canvas": {
    "background": "#ffffff",
    "grid": {
      "visible": false,
      "size": 20,
      "snap": false
    }
  },
  "viewport": {
    "x": 0,
    "y": 0,
    "zoom": 1
  },
  "elements": [
    {
      "id": "el_NodeStart01",
      "type": "rectangle",
      "x": 60,
      "y": 100,
      "width": 140,
      "height": 70,
      "angle": 0,
      "zIndex": 1000,
      "opacity": 1,
      "locked": false,
      "visible": true,
      "groupId": null,
      "style": {
        "stroke": "#1971c2",
        "strokeWidth": 2,
        "strokeStyle": "solid",
        "fill": "#a5d8ff",
        "fillStyle": "solid",
        "roughness": 0
      },
      "label": {
        "text": "Start",
        "fontFamily": "sans",
        "fontSize": 16,
        "fontWeight": 500,
        "lineHeight": 1.25,
        "color": "#1e1e1e",
        "textAlign": "center",
        "verticalAlign": "middle",
        "padding": 8
      },
      "meta": {},
      "cornerRadius": 8,
      "frameId": null
    },
    {
      "id": "el_NodeMiddle1",
      "type": "ellipse",
      "x": 320,
      "y": 90,
      "width": 140,
      "height": 90,
      "angle": 0,
      "zIndex": 2000,
      "opacity": 1,
      "locked": false,
      "visible": true,
      "groupId": null,
      "style": {
        "stroke": "#2f9e44",
        "strokeWidth": 2,
        "strokeStyle": "solid",
        "fill": "#b2f2bb",
        "fillStyle": "solid",
        "roughness": 0
      },
      "label": {
        "text": "Decide",
        "fontFamily": "sans",
        "fontSize": 16,
        "fontWeight": 500,
        "lineHeight": 1.25,
        "color": "#1e1e1e",
        "textAlign": "center",
        "verticalAlign": "middle",
        "padding": 8
      },
      "meta": {},
      "frameId": null
    },
    {
      "id": "el_NodeEnd0001",
      "type": "sticky",
      "x": 330,
      "y": 300,
      "width": 160,
      "height": 120,
      "angle": 0,
      "zIndex": 3000,
      "opacity": 1,
      "locked": false,
      "visible": true,
      "groupId": null,
      "style": {
        "stroke": "transparent",
        "strokeWidth": 0,
        "strokeStyle": "solid",
        "fill": "#ffec99",
        "fillStyle": "solid",
        "roughness": 0
      },
      "label": null,
      "meta": {},
      "text": "Done",
      "fontFamily": "sans",
      "fontSize": 16,
      "fontWeight": 400,
      "lineHeight": 1.25,
      "color": "#1e1e1e",
      "textAlign": "left",
      "verticalAlign": "top",
      "padding": 12,
      "frameId": null
    },
    {
      "id": "el_ArrowAuto01",
      "type": "arrow",
      "x": 204,
      "y": 131.9,
      "width": 112,
      "height": 1,
      "angle": 0,
      "zIndex": 4000,
      "opacity": 1,
      "locked": false,
      "visible": true,
      "groupId": null,
      "style": {
        "stroke": "#1e1e1e",
        "strokeWidth": 2,
        "strokeStyle": "solid",
        "fill": "transparent",
        "fillStyle": "none",
        "roughness": 0
      },
      "label": null,
      "meta": {
        "exampleNote": "Both ends use anchor mode 'auto'. The stored points are a CACHE of the last computed route - a reader that moves either node MUST re-route using docs/07-rendering.md#binding-resolution."
      },
      "points": [
        [
          0,
          0
        ],
        [
          112,
          3.1
        ]
      ],
      "startArrowhead": "none",
      "endArrowhead": "arrow",
      "curve": "straight",
      "startBinding": {
        "elementId": "el_NodeStart01",
        "anchor": {
          "mode": "auto"
        },
        "gap": 4
      },
      "endBinding": {
        "elementId": "el_NodeMiddle1",
        "anchor": {
          "mode": "auto"
        },
        "gap": 4
      },
      "frameId": null
    },
    {
      "id": "el_ArrowFixed1",
      "type": "arrow",
      "x": 390,
      "y": 184,
      "width": 20,
      "height": 112,
      "angle": 0,
      "zIndex": 5000,
      "opacity": 1,
      "locked": false,
      "visible": true,
      "groupId": null,
      "style": {
        "stroke": "#e8590c",
        "strokeWidth": 2,
        "strokeStyle": "solid",
        "fill": "transparent",
        "fillStyle": "none",
        "roughness": 0
      },
      "label": {
        "text": "yes",
        "fontFamily": "sans",
        "fontSize": 13,
        "fontWeight": 400,
        "lineHeight": 1.25,
        "color": "#e8590c",
        "textAlign": "center",
        "verticalAlign": "middle",
        "padding": 4
      },
      "meta": {
        "exampleNote": "Fixed anchors pin the endpoint to a normalised spot on the target's local unrotated box: u=0.5,v=1 is the bottom-centre of the ellipse; u=0.5,v=0 is the top-centre of the sticky."
      },
      "points": [
        [
          0,
          0
        ],
        [
          20,
          112
        ]
      ],
      "startArrowhead": "none",
      "endArrowhead": "arrow",
      "curve": "elbow",
      "startBinding": {
        "elementId": "el_NodeMiddle1",
        "anchor": {
          "mode": "fixed",
          "u": 0.5,
          "v": 1
        },
        "gap": 4
      },
      "endBinding": {
        "elementId": "el_NodeEnd0001",
        "anchor": {
          "mode": "fixed",
          "u": 0.5,
          "v": 0
        },
        "gap": 4
      },
      "frameId": null
    },
    {
      "id": "el_ArrowHalf01",
      "type": "arrow",
      "x": 130,
      "y": 190,
      "width": 190,
      "height": 130,
      "angle": 0,
      "zIndex": 6000,
      "opacity": 1,
      "locked": false,
      "visible": true,
      "groupId": null,
      "style": {
        "stroke": "#868e96",
        "strokeWidth": 2,
        "strokeStyle": "dashed",
        "fill": "transparent",
        "fillStyle": "none",
        "roughness": 0
      },
      "label": null,
      "meta": {
        "exampleNote": "Only one end is bound. The free end keeps whatever position it was left at, and is used as the reference point when resolving the bound end's auto anchor."
      },
      "points": [
        [
          0,
          0
        ],
        [
          80,
          90
        ],
        [
          190,
          130
        ]
      ],
      "startArrowhead": "none",
      "endArrowhead": "arrow",
      "curve": "curved",
      "startBinding": {
        "elementId": "el_NodeStart01",
        "anchor": {
          "mode": "auto"
        },
        "gap": 4
      },
      "endBinding": null,
      "frameId": null
    }
  ],
  "files": {}
}
